{
    "format": "ail",
    "version": 1,
    "type": "item",
    "meta": {
       "uuid": "03c51929-eeab-4d47-9dc0-c667f94c7d2c",
       "uuid_org": "28bc3db3-16da-461c-b20b-b944f4058708",
       "tags": ["mails", "custom_tag"],
       "encoding": "base64",
       "compress": "gzip",
       "ail:id": "object_id",
       "ail:mime-type": "text/plain",
       "ail:subtype": "foobar"
    },
    "payload": {
       "raw" : "MjhiYzNkYjMtMTZkYS00NjFjLWIyMGItYjk0NGY0MDU4NzA4Cg=="
    }
}
